{
  "asm_version": "0.2",
  "service_id": "elevenlabs/tts-v2@2.0",
  "taxonomy": "ai.audio.tts",
  "display_name": "ElevenLabs TTS v2",
  "provider": {
    "name": "ElevenLabs",
    "url": "https://elevenlabs.io"
  },
  "capabilities": {
    "description": "Premium text-to-speech with voice cloning, emotional range, and 32 languages",
    "input_modalities": ["text"],
    "output_modalities": ["audio"],
    "supported_languages": ["en", "zh", "ja", "ko", "fr", "de", "es", "pt", "ar", "hi", "it", "pl", "nl", "sv", "tr"],
    "max_input_size": "5000 characters"
  },
  "pricing": {
    "billing_dimensions": [
      {
        "dimension": "character",
        "unit": "per_1M",
        "cost_per_unit": 180.00,
        "currency": "USD"
      }
    ]
  },
  "quality": {
    "metrics": [
      {
        "name": "MOS",
        "score": 4.5,
        "scale": "1-5",
        "benchmark": "Internal MOS evaluation",
        "self_reported": true
      }
    ]
  },
  "sla": {
    "latency_p50": "400ms",
    "latency_p99": "2s",
    "throughput": "10 req/s",
    "uptime": 0.999
  },
  "payment": {
    "methods": ["api_key_prepaid", "stripe"],
    "auth_type": "api_key",
    "signup_url": "https://elevenlabs.io/pricing"
  },
  "extensions": {
    "tts": {
      "voice_count": 1000,
      "supports_voice_cloning": true,
      "supports_streaming": true,
      "supports_ssml": true,
      "output_formats": ["mp3", "wav", "ogg", "pcm"]
    }
  }
}
