{
  "asm_version": "0.2",
  "service_id": "google/gemini-2.5-pro@2.5",
  "taxonomy": "ai.llm.chat",
  "display_name": "Gemini 2.5 Pro",
  "provider": {
    "name": "Google",
    "url": "https://ai.google.dev",
    "verified_by": ["google-cloud-marketplace"]
  },
  "capabilities": {
    "description": "Advanced reasoning model with 1M token context, multimodal input including video",
    "input_modalities": ["text", "image", "audio", "video"],
    "output_modalities": ["text"],
    "supported_languages": ["en", "zh", "ja", "ko", "fr", "de", "es", "pt", "ar", "hi"],
    "context_window": 1000000
  },
  "pricing": {
    "billing_dimensions": [
      {
        "dimension": "input_token",
        "unit": "per_1M",
        "cost_per_unit": 1.25,
        "currency": "USD",
        "conditions": {
          "when": "context > 200K tokens",
          "cost_per_unit": 2.50
        }
      },
      {
        "dimension": "output_token",
        "unit": "per_1M",
        "cost_per_unit": 10.00,
        "currency": "USD",
        "conditions": {
          "when": "context > 200K tokens",
          "cost_per_unit": 15.00
        }
      }
    ],
    "free_tier": {
      "dimension": "request",
      "limit": 25,
      "period": "daily"
    }
  },
  "quality": {
    "metrics": [
      {
        "name": "LMSYS_Elo",
        "score": 1300,
        "scale": "Elo",
        "benchmark": "LMSYS Chatbot Arena",
        "benchmark_url": "https://lmarena.ai",
        "evaluated_at": "2026-03-15",
        "self_reported": false
      }
    ],
    "leaderboard_rank": {
      "name": "LMSYS Chatbot Arena",
      "rank": 2,
      "total": 150,
      "url": "https://lmarena.ai",
      "snapshot_date": "2026-03-15"
    }
  },
  "sla": {
    "latency_p50": "1.5s",
    "latency_p99": "8s",
    "throughput": "60 tokens/s",
    "uptime": 0.999,
    "rate_limit": "1000 req/min",
    "regions": ["us-central1", "eu-west-1"]
  },
  "payment": {
    "methods": ["api_key_prepaid", "invoice"],
    "auth_type": "api_key",
    "signup_url": "https://aistudio.google.com"
  },
  "extensions": {
    "llm": {
      "supports_function_calling": true,
      "supports_vision": true,
      "supports_extended_thinking": true,
      "max_output_tokens": 65536
    }
  }
}
