{
  "asm_version": "0.2",
  "service_id": "openai/text-embedding-3-large@3.0",
  "taxonomy": "ai.llm.embedding",
  "display_name": "text-embedding-3-large",
  "provider": {
    "name": "OpenAI",
    "url": "https://openai.com",
    "verified_by": ["azure-marketplace"]
  },
  "capabilities": {
    "description": "High-dimensional text embedding model (3072 dimensions) for semantic search and RAG",
    "input_modalities": ["text"],
    "output_modalities": ["structured_data"],
    "supported_languages": ["en", "zh", "ja", "ko", "fr", "de", "es"],
    "context_window": 8191
  },
  "pricing": {
    "billing_dimensions": [
      {
        "dimension": "token",
        "unit": "per_1M",
        "cost_per_unit": 0.13,
        "currency": "USD"
      }
    ]
  },
  "quality": {
    "metrics": [
      {
        "name": "MTEB_avg",
        "score": 64.6,
        "scale": "0-100",
        "benchmark": "MTEB",
        "benchmark_url": "https://huggingface.co/spaces/mteb/leaderboard",
        "evaluated_at": "2026-01-15",
        "self_reported": false
      }
    ]
  },
  "sla": {
    "latency_p50": "100ms",
    "latency_p99": "500ms",
    "throughput": "3000 req/min",
    "uptime": 0.999,
    "regions": ["us-east-1", "eu-west-1"]
  },
  "payment": {
    "methods": ["api_key_prepaid", "stripe"],
    "auth_type": "api_key",
    "signup_url": "https://platform.openai.com"
  },
  "extensions": {
    "embedding": {
      "dimensions": 3072,
      "supports_dimension_reduction": true,
      "similarity_metric": "cosine"
    }
  }
}
